{
  "name": "relation",
  "package": "relation",
  "description": "Relation Model",
  "icon": "star",
  "ordering": [
    {
      "column": "created"
    }
  ],
  "search": [
    "lower(id::text)",
    "lower(name)"
  ],
  "columns": [
    {
      "name": "id",
      "type": "uuid",
      "pk": true,
      "search": true
    },
    {
      "name": "basic_id",
      "type": "uuid"
    },
    {
      "name": "name",
      "type": "string",
      "search": true,
      "tags": [
        "title"
      ]
    },
    {
      "name": "created",
      "type": "timestamp",
      "sqlDefault": "now()",
      "tags": [
        "created"
      ]
    }
  ],
  "relations": [
    {
      "name": "relation_fk",
      "src": [
        "basic_id"
      ],
      "table": "basic",
      "tgt": [
        "id"
      ]
    }
  ]
}
