{
  "name": "Capital",
  "package": "capital",
  "description": "Proper case table",
  "icon": "star",
  "title": "Capital",
  "columns": [
    {
      "name": "ID",
      "type": "string",
      "pk": true,
      "search": true
    },
    {
      "name": "Name",
      "type": "string",
      "search": true,
      "tags": [
        "title"
      ]
    },
    {
      "name": "Birthday",
      "type": "timestamp",
      "search": true
    },
    {
      "name": "Deathday",
      "type": "timestamp",
      "nullable": true,
      "search": true
    }
  ]
}