{
  "name": "softdel",
  "package": "softdel",
  "description": "Soft-deleted table",
  "icon": "star",
  "ordering": [
    {
      "column": "created"
    }
  ],
  "tags": [
    "softDelete"
  ],
  "columns": [
    {
      "name": "id",
      "type": "string",
      "pk": true,
      "search": true
    },
    {
      "name": "created",
      "type": "timestamp",
      "sqlDefault": "now()",
      "tags": [
        "created"
      ]
    },
    {
      "name": "updated",
      "type": "timestamp",
      "nullable": true,
      "sqlDefault": "now()",
      "tags": [
        "updated"
      ]
    },
    {
      "name": "deleted",
      "type": "timestamp",
      "nullable": true,
      "sqlDefault": "now()",
      "tags": [
        "deleted"
      ]
    }
  ]
}
