{
  "name": "audited",
  "package": "audited",
  "description": "Audited Model",
  "icon": "star",
  "ordering": [
    {
      "column": "name"
    }
  ],
  "search": [
    "lower(id::text)",
    "lower(name)"
  ],
  "tags": [
    "audit"
  ],
  "columns": [
    {
      "name": "id",
      "type": "uuid",
      "pk": true,
      "search": true
    },
    {
      "name": "name",
      "type": "string",
      "search": true,
      "tags": [
        "title"
      ]
    }
  ]
}