{
  "name": "basic",
  "package": "basic",
  "description": "Basic Model",
  "icon": "star",
  "ordering": [
    {
      "column": "created"
    }
  ],
  "search": [
    "lower(id::text)",
    "lower(name)"
  ],
  "columns": [
    {
      "name": "id",
      "type": "uuid",
      "pk": true,
      "search": true
    },
    {
      "name": "name",
      "type": "string",
      "search": true,
      "tags": [
        "title"
      ]
    },
    {
      "name": "status",
      "type": "string",
      "format": "select",
      "values": [
        "a",
        "b",
        "c"
      ]
    },
    {
      "name": "created",
      "type": "timestamp",
      "sqlDefault": "now()",
      "tags": [
        "created"
      ]
    }
  ],
  "indexes": [
    {
      "name": "basic_created_idx",
      "decl": "\"basic\" (\"created\")"
    }
  ]
}